[
  {
    "name": "entity.before.create",
    "phase": "before",
    "definedBy": "core",
    "when": "an entity is about to be created (any entity type the subscription lists)",
    "subject": "the entity record: `{ id, type, ...fields, ext: { <plugin>: {...} } }` as submitted",
    "previous": "none",
    "returns": "the record (may change it)",
    "veto": true,
    "detachable": false,
    "comment": "validate or normalize the new record, or veto with a message",
    "example": "**comments** rejects a comment over the length limit or from a blocked user; **spam** vetoes obvious spam"
  },
  {
    "name": "entity.after.create",
    "phase": "after",
    "definedBy": "core",
    "when": "the entity was created and stored",
    "subject": "the entity record: `{ id, type, ...fields, ext: { <plugin>: {...} } }` as stored, with its new `id`",
    "previous": "none",
    "returns": "the record as the caller receives it (annotations); the store is not rewritten",
    "veto": false,
    "detachable": true,
    "comment": "react to the new record: notify, index, update a derived store",
    "example": "**search** indexes the new record; **notifications** emails moderators about a new comment"
  },
  {
    "name": "entity.before.read",
    "phase": "before",
    "definedBy": "core",
    "when": "an entity or list is about to be read",
    "subject": "`{ type, id?, query }` (what is being asked for)",
    "previous": "none",
    "returns": "the request (narrow a query, add filters)",
    "veto": true,
    "detachable": false,
    "comment": "narrow what is read (for example hide drafts from anonymous callers), or veto",
    "example": "**comments** hides unapproved comments from anonymous readers by narrowing the query"
  },
  {
    "name": "entity.after.read",
    "phase": "after",
    "definedBy": "core",
    "when": "the entity or list was loaded",
    "subject": "the record, or `{ items: [records], total }` for a list, with `ext.<plugin>` annotations",
    "previous": "none",
    "returns": "the record or list as the caller receives it (annotate, redact)",
    "veto": false,
    "detachable": false,
    "comment": "annotate or redact what the caller receives; not detachable because the caller waits for it",
    "example": "**example** adds an `ext.awesome.explosions` count to each file it lists; **privacy** redacts emails for non-admins"
  },
  {
    "name": "entity.before.update",
    "phase": "before",
    "definedBy": "core",
    "when": "an entity is about to be updated",
    "subject": "the entity record: `{ id, type, ...fields, ext: { <plugin>: {...} } }` with the submitted changes merged",
    "previous": "the stored record",
    "returns": "the record (may change it)",
    "veto": true,
    "detachable": false,
    "comment": "compare with ctx.previous, normalize, or veto",
    "example": "**announcements** refuses to edit an announcement that is already published to all users"
  },
  {
    "name": "entity.after.update",
    "phase": "after",
    "definedBy": "core",
    "when": "the update was stored",
    "subject": "the entity record: `{ id, type, ...fields, ext: { <plugin>: {...} } }` as stored",
    "previous": "the record before the update",
    "returns": "the record as the caller receives it",
    "veto": false,
    "detachable": true,
    "comment": "react to what changed between ctx.previous and the subject",
    "example": "**search** re-indexes; **page-cache** invalidates cached pages that showed the record"
  },
  {
    "name": "entity.before.delete",
    "phase": "before",
    "definedBy": "core",
    "when": "an entity is about to be deleted",
    "subject": "the stored record",
    "previous": "none",
    "returns": "nothing",
    "veto": true,
    "detachable": false,
    "comment": "refuse deletion (for example while something depends on it), or veto",
    "example": "**media-library** refuses to delete a file that pages still embed"
  },
  {
    "name": "entity.after.delete",
    "phase": "after",
    "definedBy": "core",
    "when": "the entity was deleted",
    "subject": "the record as it was before deletion",
    "previous": "none",
    "returns": "nothing",
    "veto": false,
    "detachable": true,
    "comment": "clean up anything that pointed at the deleted record",
    "example": "**comments** deletes the thread when its page is deleted (cascade)"
  },
  {
    "name": "page.before.save",
    "phase": "before",
    "definedBy": "core",
    "when": "page content or metadata is about to be written (editor save, CLI, import)",
    "aliasOf": [
      {
        "hook": "entity.before.create",
        "entities": [
          "page"
        ]
      },
      {
        "hook": "entity.before.update",
        "entities": [
          "page"
        ]
      }
    ],
    "subject": "the page: `{ id, siteId, title, location, slug, parent, order, content, metadata }` as submitted",
    "previous": "the stored page",
    "returns": "the page (may change content or metadata)",
    "veto": true,
    "detachable": false,
    "comment": "inspect or adjust the page before it is written (for example clean up markup), or veto",
    "example": "**a11y-check** warns about images without alt text; **content-sanitize** strips pasted Word markup"
  },
  {
    "name": "page.after.save",
    "phase": "after",
    "definedBy": "core",
    "when": "the page was written to disk",
    "aliasOf": [
      {
        "hook": "entity.after.create",
        "entities": [
          "page"
        ]
      },
      {
        "hook": "entity.after.update",
        "entities": [
          "page"
        ]
      }
    ],
    "subject": "the page: `{ id, siteId, title, location, slug, parent, order, content, metadata }` as written",
    "previous": "the page before the save",
    "returns": "nothing (the file is already written)",
    "veto": false,
    "detachable": true,
    "comment": "react to the saved page: re-index for search, invalidate a cache, notify",
    "example": "**search** re-indexes the page; **page-cache** drops that page's cached HTML; **xapi** records an authoring event"
  },
  {
    "name": "page.before.delete",
    "phase": "before",
    "definedBy": "core",
    "when": "a page is about to be deleted (outline editor, CLI)",
    "aliasOf": [
      {
        "hook": "entity.before.delete",
        "entities": [
          "page"
        ]
      }
    ],
    "subject": "the page: `{ id, siteId, title, location, slug, parent, order, content, metadata }` as stored",
    "previous": "none",
    "returns": "nothing",
    "veto": true,
    "detachable": false,
    "comment": "refuse to delete a page others link to, or veto",
    "example": "**comments** warns that the page's thread will be deleted; **link-check** refuses while other pages link here"
  },
  {
    "name": "page.after.delete",
    "phase": "after",
    "definedBy": "core",
    "when": "the page was deleted",
    "aliasOf": [
      {
        "hook": "entity.after.delete",
        "entities": [
          "page"
        ]
      }
    ],
    "subject": "the page: `{ id, siteId, title, location, slug, parent, order, content, metadata }` as it was before deletion",
    "previous": "none",
    "returns": "nothing",
    "veto": false,
    "detachable": true,
    "comment": "clean up anything tied to the deleted page",
    "example": "**comments** deletes the thread; **search** drops the page from the index"
  },
  {
    "name": "manifest.before.save",
    "phase": "before",
    "definedBy": "core",
    "when": "site.json is about to be written (outline change, settings save, theme change)",
    "aliasOf": [
      {
        "hook": "entity.before.update",
        "entities": [
          "site"
        ]
      }
    ],
    "subject": "the site manifest: the full `site.json` object (`{ id, title, author, metadata, items: [...] }`) as it will be written",
    "previous": "the stored manifest",
    "returns": "the manifest (may change it)",
    "veto": true,
    "detachable": false,
    "comment": "inspect or adjust site.json before it is written, or veto",
    "example": "**regions** moves region data out of `site.json` into its own store before the write"
  },
  {
    "name": "manifest.after.save",
    "phase": "after",
    "definedBy": "core",
    "when": "site.json was written",
    "aliasOf": [
      {
        "hook": "entity.after.update",
        "entities": [
          "site"
        ]
      }
    ],
    "subject": "the site manifest: the full `site.json` object (`{ id, title, author, metadata, items: [...] }`) as written",
    "previous": "the manifest before the save",
    "returns": "nothing",
    "veto": false,
    "detachable": true,
    "comment": "react to outline or settings changes: rebuild a derived file, notify",
    "example": "**sitemap / llms.txt** regenerate; **page-cache** clears the menu-dependent cache"
  },
  {
    "name": "theme.before.change",
    "phase": "before",
    "definedBy": "core",
    "when": "a site's theme is about to change (site settings, CLI)",
    "aliasOf": [
      {
        "hook": "entity.before.update",
        "entities": [
          "site"
        ],
        "changed": [
          "metadata.theme"
        ]
      }
    ],
    "subject": "`{ siteId, theme, settings }` (the new theme and its settings)",
    "previous": "`{ theme, settings }` currently in use",
    "returns": "the new theme and settings (may adjust settings)",
    "veto": true,
    "detachable": false,
    "comment": "check the new theme is compatible, or veto",
    "example": "**institution-skeleton** (HAXiam) refuses themes outside the approved list; **regions** checks the new theme renders its regions"
  },
  {
    "name": "theme.after.change",
    "phase": "after",
    "definedBy": "core",
    "when": "the theme change was saved",
    "aliasOf": [
      {
        "hook": "entity.after.update",
        "entities": [
          "site"
        ],
        "changed": [
          "metadata.theme"
        ]
      }
    ],